{
  "tier": 0,
  "payloadType": "application/clearance-manifest+json",
  "payload": "{\"@context\":[\"https://schema.org/\",\"http://purl.org/dc/terms/\",\"https://openclearance.org/v0.1/context.jsonld\"],\"type\":\"ClearanceManifest\",\"specVersion\":\"0.1\",\"work\":{\"id\":\"met:436535\",\"title\":\"Wheat Field with Cypresses\",\"artist\":{\"name\":\"Vincent van Gogh\",\"nationality\":\"Dutch\",\"lifespan\":\"1853–1890\",\"attributionType\":\"named\"},\"displayDate\":\"1889\",\"yearStart\":1889,\"yearEnd\":1889,\"medium\":\"Oil on canvas\"},\"source\":{\"museum\":{\"code\":\"met\",\"name\":\"The Metropolitan Museum of Art\",\"url\":\"https://www.metmuseum.org\"},\"apiUrl\":\"https://collectionapi.metmuseum.org/public/collection/v1/objects/436535\",\"pageUrl\":\"https://www.metmuseum.org/art/collection/search/436535\",\"imageUrls\":{\"full\":\"https://images.metmuseum.org/CRDImages/ep/original/DT1567.jpg\",\"thumbnail\":\"https://images.metmuseum.org/CRDImages/ep/web-large/DT1567.jpg\"}},\"rights\":{\"statement\":\"https://creativecommons.org/publicdomain/zero/1.0/\",\"sourceApiValue\":{\"field\":\"isPublicDomain\",\"value\":\"true\"},\"imageOpenAccess\":true,\"metadataOpenAccess\":true,\"confidence\":\"high\"},\"clearance\":{\"commercialReproduction\":{\"permitted\":true,\"basis\":{\"rule\":\"cc0-grants-commercial\",\"inputs\":[{\"field\":\"license.type\",\"value\":\"CC0\"}],\"summary\":\"CC0 public-domain dedication permits all uses, including commercial.\"}},\"derivatives\":{\"permitted\":true,\"basis\":{\"rule\":\"cc0-grants-derivatives\",\"inputs\":[{\"field\":\"license.type\",\"value\":\"CC0\"}],\"summary\":\"CC0 public-domain dedication permits modification and derivative works.\"}},\"attributionRequired\":{\"required\":false,\"basis\":{\"rule\":\"cc0-waives-attribution\",\"inputs\":[{\"field\":\"license.type\",\"value\":\"CC0\"}],\"summary\":\"CC0 public-domain dedication requires no attribution as a condition of reuse.\"}}},\"verification\":{\"determinedBy\":{\"actor\":\"museum:met\",\"role\":\"rights-source\"},\"tool\":\"open-museum-mcp@0.7.0 · met.isPublicDomain\",\"determinedAt\":\"2026-06-04T09:15:00.000Z\",\"ruleContext\":\"met.isPublicDomain='true' ⇒ CC0\",\"determinationSource\":{\"type\":\"api-field\",\"field\":\"isPublicDomain\",\"url\":\"https://collectionapi.metmuseum.org/public/collection/v1/objects/436535\",\"retrievedAt\":\"2026-06-04T09:15:00.000Z\"}},\"citation\":{\"full\":\"Vincent van Gogh, Wheat Field with Cypresses. 1889. The Metropolitan Museum of Art. CC0. https://www.metmuseum.org/art/collection/search/436535.\",\"caption\":\"Vincent van Gogh, Wheat Field with Cypresses, 1889. Oil on canvas. The Metropolitan Museum of Art, CC0. https://www.metmuseum.org/art/collection/search/436535\",\"short\":\"Wheat Field with Cypresses (Vincent van Gogh, 1889)\"}}",
  "integrity": {
    "alg": "sha-256",
    "hash": "aad0a0353341622f8f89fe5e2a99ee07413ad4451c5eb6a2e900588b75c6ac8e"
  }
}
