{
  "tier": 0,
  "payloadType": "application/clearance-manifest+json",
  "payload": "{\"@context\":[\"https://schema.org/\",\"http://purl.org/dc/terms/\",\"https://w3id.org/clearance-manifest/v0.1/context.jsonld\"],\"type\":\"ClearanceManifest\",\"specVersion\":\"0.1\",\"work\":{\"id\":\"test:9999\"},\"source\":{\"museum\":{\"code\":\"test\"}},\"rights\":{\"statement\":\"https://creativecommons.org/publicdomain/zero/1.0/\",\"sourceApiValue\":{\"field\":\"license\",\"value\":\"CC0\"},\"imageOpenAccess\":true,\"metadataOpenAccess\":true,\"confidence\":\"high\"},\"clearance\":{\"commercialReproduction\":{\"permitted\":true,\"basis\":{\"rule\":\"vendor-custom-permit\",\"inputs\":[{\"field\":\"license\",\"value\":\"CC0\"}],\"summary\":\"Vendor-defined rule: permits commercial use under CC0 (unrecognised by v0.1 baseline).\"}},\"derivatives\":{\"permitted\":true,\"basis\":{\"rule\":\"vendor-custom-permit\",\"inputs\":[{\"field\":\"license\",\"value\":\"CC0\"}],\"summary\":\"Vendor-defined rule: permits derivatives (unrecognised by v0.1 baseline).\"}},\"attributionRequired\":{\"required\":false,\"basis\":{\"rule\":\"vendor-custom-waive\",\"inputs\":[{\"field\":\"license\",\"value\":\"CC0\"}],\"summary\":\"Vendor-defined rule: waives attribution (unrecognised by v0.1 baseline).\"}}},\"verification\":{\"determinedBy\":{\"actor\":\"engine:test\",\"role\":\"rights-gate\"},\"tool\":\"test@0.0.1\",\"determinedAt\":\"2026-06-12T00:00:00.000Z\",\"ruleContext\":\"test\",\"determinationSource\":{\"type\":\"api-field\",\"field\":\"license\",\"url\":\"https://example.com/api/9999\",\"retrievedAt\":\"2026-06-12T00:00:00.000Z\"}}}",
  "integrity": {
    "alg": "sha-256",
    "hash": "b556f3a0d9d04e31611a5104f6e009a800271380870a60ffa7601293f3eec5f9"
  }
}
